{
  "$schema": "../../../../docs/expertise-record.schema.json",
  "slug": "aerodynamic-design",
  "title": "Aerodynamic Design and CFD",
  "shortTitle": "Aerodynamics & CFD",
  "metaDescription": "How Aaryan Lath applies aerodynamics and CFD: Ahmed body vehicle simulations and slant-angle drag sweeps in AAE 412, plus graduate AAE 514 aerodynamics.",
  "hero": "Aerodynamics is the thread running through Aaryan's coursework at Purdue: he has simulated vehicle aerodynamics in CFD, swept geometry to study its effect on drag and downforce, and carried graduate aerodynamics coursework as an undergraduate.",
  "tags": ["CFD", "Vehicle Aerodynamics", "Graduate Coursework"],
  "evidence": [
    {
      "context": "AAE 412: Computational Fluid Dynamics, an advanced CFD course in Purdue's School of Aeronautics and Astronautics.",
      "whatIDid": "Simulated the aerodynamic performance of a car using an Ahmed body approximation, sweeping slant angles to study their effect on drag, downforce, and overall vehicle behavior, then wrote up the methodology and results in a course report.",
      "outcome": "The full report is available from the Academia section of this site via OneDrive.",
      "sourceUrl": "/academia",
      "sourceLabel": "See the Academia page",
      "groundedIn": ["src/app/page.tsx"]
    },
    {
      "context": "Graduate-level aerodynamics coursework taken as an undergraduate in Purdue's aerospace engineering program.",
      "whatIDid": "Completed AAE 514 Intermediate Aerodynamics alongside AAE 550 Multidisciplinary Design Optimization, deliberately loading graduate courses on top of the standard aerospace curriculum while serving as a teaching assistant for AAE 251.",
      "outcome": "Carried a 3.73 GPA and Dean's List standing every semester through that load.",
      "sourceUrl": "/academia",
      "sourceLabel": "Coursework details",
      "groundedIn": ["src/app/page.tsx", "src/data/about-aaryan.ts"]
    }
  ],
  "courses": [
    {
      "code": "AAE 412",
      "note": "Computational Fluid Dynamics: Ahmed body vehicle simulation and slant-angle drag and downforce study."
    },
    {
      "code": "AAE 514",
      "note": "Intermediate Aerodynamics, taken at the graduate level as an undergraduate."
    }
  ],
  "projects": [],
  "tools": ["CFD simulation", "Ahmed body modeling", "MATLAB"],
  "relatedSlugs": ["design-optimization", "aircraft-design", "aerospace-propulsion"],
  "knowsAbout": "Aerodynamics",
  "sameAs": [],
  "lastReviewed": "2026-07-12"
}
